Id,Body,oblast,odgovor
2820,I'm 41 regular gym visitor for one year general fitness level OK but not great Recently I started to enjoy a kickbox aerobics course at my gym I realized I hardly ever trained such rapid movements (except in soccer) but I'm improving However during the workout I cannot make the roundhouse kicks parallel to the ground without losing control let alone make high kicks What should I do to improve that Focusing on the muscles in the legs focusing on the core becoming more flexible in general (I know only slight improvements possible) all of the above I think the answer is all of the above But how to start Any suggestions for a good compilation of exercises on the gym machines or choosing a supplemental course What to avoid,fitness,2944
2830,I've been using my stationary bike to do cardio 3 times a week for about 50 minutes each session for almost 2 months now When I started off I found it very uncomfortable to sit on the seat so I got a softer seat which didn't really help Now after about 30 minutes into the session I find it very painful and am sore for about 2 days after finishing a session Is it possible to avoid getting sore,fitness,2831
2834,Just what the title says What will be the tradeoff of losing weight only by running on a treadmill instead of doing separate muscle group workout,fitness,2838
2840,Various weightlifting and exercise resources either claim that ATG squats (a**-to-ground i e as low as you can) are perfectly fine or claim they will destroy your knees in two sessions I was wondering if anyone has any insight as to what is going on here Will a properly performed (weighted) squat that brings legs below parallel to the ground have any greater negative impact on the knees or other joints compared to parallel squats Lets assume for a moment we aren't talking about competitive weightlifting weights so with a squat weight smaller than 1 5x your body mass Personally I side with the it won't do anything wrong side considering that With bar weight at approximately your body mass you could exchange the bar with squatting on one leg i e this is strain your body is designed to be able to withstand If you assume that there is the possibility of excess joint strain you would be seeing epidemic levels of knee injuries among competitive weightlifters who routinely go below parallel in the clean&amp;jerk with much greater weight and while weightlifters can get various joint injuries I haven't seen anything demonstrating that injuries are more biased towards the knee,fitness,2897
2843,I hear a lot of people talking about going to the gym to tone up their muscles What they usually do to improve their tone is to do relatively high reps with relatively low weights - say 30-50 reps with 30-50% max These exercises are done without changing anything else about their diet or exercise routine Does this sort of workout successfully tone specific muscles or a person's entire body Clarification I'm using the word tone to mean improving the shapeliness of existing muscle rather than the scientific definition muscle tension at rest,fitness,2845
2848,When doing bench presses both the left and right areas of my shoulders make this really loud clicking sound and it feels as if the bones are clicking against each other This has been happening for a few months now I thought it would go away however it remains exactly the same Any thoughts would be appreciated thanks,fitness,2861
2849,Would it be better to spread my workout into two different shifts or better to do it all at once My focus is to lose fat gain muscle I am 5'11 weight 185 lbs and I'm 26 years old I currently use Arnold's weight lifting program which I found on the web Then I do post workout cardio 45 minutes of elliptical and 15 minutes of treadmill at 3 5 - 4 0 speed I'm thinking of doing half the weight lifting in the morning with the full cardio program mentioned above Then doing the rest of the weight lifting at night with another full cardio program,fitness,2850
2853,What are some good exercise programs to lose as much body fat possible in a short period of time but still keeping it healthy A treadmill and elliptical is available to me 24/7 I am 5'11 and weight 185lbs and I have lots of body fat,fitness,2856
2855,I'm looking for some way to exercise my upper trapezius muscles using only my body weight Normally this would be accomplished with shrugs or upright rowing but without weight shrugs and rowing are practically useless I think every other muscle gets hit during my workout cycle but I'm missing my upper traps EDIT I have Erb's Palsy (right arm) due to a birth injury and hence cannot do handstands of any kind,fitness,2937
2868,I found when exercising (through Kinect pilates video etc) that I am asked to 'engage my core' How do I do this How do I know when I am truly engaging my core rather than just sucking in my stomache,fitness,2871
2869,I have had a couple of lower back surgeries in the past but I'm okay to do any activity During the last 10 years I have gained a little more weight around the mid section but have been actively trying to lose the weight but with little success I'm currently doing hot yoga to increase my flexibility but as for weight loss I'm doing cardio with some weight lifting but not seeing the results I would like to see I've also changed my diet times I've been eating and the amount I eat to a healthier diet with smaller amounts about 5 times a day I heard this would increase my metabolism I'm about 6'3 230 pounds but would like to be around 190 any advice on exercise diet etc Currently I hit the gym 2 to 3 times a week and yoga every other week I would like to do more of both but being a dad of four time is limited I have been working out in the morning for about an hour (usually cardio) and one day of the weekend for about 2 hours (Full body upper/lower),fitness,2870
2872,Is it healthy or is it damaging to exercise a muscle while it's still sore from a previous workout,fitness,2890
2875,What are some good exercises that utilize free weights to increase leg strength,fitness,2881
2883,I've recently started taking BCAA to help me recuperate after a gym session as it was taking me a long time to recuperate Now recuperation is almost instant I'm trying to gain muscle mass which is working fairly well But wanted to know what would be the next supplement to take I'm already taking my daily protein shake (39 grams of protein) multi-vitamin Omega-3 and now BCAA I'm only taking 2 doses of the BCAA and the instructions says I can take up to three a day Any suggestions or great articles would be great I already read a lot but all everyone offers is an opinion but no real general guideline I should also note that I also take Siberian Ginseng,fitness,2884
2886,I got a shakeweight as a gag gift for Christmas I actually tried it and it does feel like you get a work out from the instructional DVD I'm curious if the principles behind the product are sound Can you really build muscle through the quick impulses of muscle contractions that device requires Can I actually look like the guy in the video from doing just Shakeweight,fitness,2889
2894,While ellipticals offer stationary movement with low impact on the knees they also seem to offer burning off insane amounts of calories when compared to equal time/work on a treadmill Same brand equipment similar workout profiles ~200 calories 30 minutes on a treadmill ~670 calories 30 minutes on an eliptical ~200 calories 30 minutes on a bike I've heard from many different sources including personal trainers both sides that ellipticals are great for burning calories and also that they are just lies The equipment I have at home all have a calorie counter that continues to climb even if i'm stationary It's making assumptions about my effort to determine calories burned so I dont believe either one The equipment at gyms ask for weight height and even use your heart rate to determine your calories burned The spread between the treadmill and the elliptical calories burned readings both from my home equipment and the gym equipment are very similar What is the truth Does the eliptical really just burn 2-3 times more calories per session than a treadmill,fitness,2898
2895,Last night at the gym I pushed myself a little too hard apperently and I threw up all over the shower I'd rather not do that again so What causes this What can I do to increase how much work I can do without throwing up,fitness,2900
2902,I'm working out 3 days a week for 1 hour - Muay Thai kickboxing + the same amount of time pumping iron at the gym The Muay Thai involves Full contact sparring Leg and arm conditioning (taking hits) Intensive core leg and arm cardio I have a reasonable healthy western diet but it's quite random and unhealthy at times too Are there either any specific nutritional based additions or changes that I should make to my diet I don't include my current diet because I only want core or optional food products that would enhance regular hard sparring (muscle damage/bruising) It's a bonus if such things are already part of my diet,fitness,2905
2903,What is the suggested amount of time to rest muscle groups between workouts to prevent injury I want to tone (improve shapeliness of existing muscle) my body and workout on average 6 times/wk lifting weights doing high intensity aerobic classes and doing the elliptical My typical regimen at the gym involves 45 min of cardio and 6 exercises (15 reps) - 3 exercises of large muscle group (ie chest) and 3 exercises of small muscle group (ie triceps),fitness,2904
