Id,Body,oblast,odgovor
2290,I've reached a point where my training runs are long enough (2 - 3 hours) and far enough (15+ miles) that I need to take on board some additional energy in the form of gels and/or sports drinks in order to complete them Is there any documented or recognised rate or consumption or guidelines as to how this should ideally be done in order to get the maximum benefits Should they be taken at regular intervals throughout the run or delayed towards the second half of the run I appreciate this will vary depending on effort and fitness; I am currently using a couple of gels and a bottle of sports drink to get me through a 19 5 mile three and a quarter hour run although the last 3 or 4 miles are still a real struggle,fitness,2349
2292,I'll start this Shoulder dislocations - great for improving shoulder mobility,fitness,3302
2293,I have heard a lot about the 'barefoot' running idea that has seemed to gain a lot of popularity with the book Born to Run The main idea is that the human foot has evolved to be very effective at running and by putting a lot of things in between it and the ground we more often cause problems then solve them I don't plan to actually run barefoot but I was thinking of getting some Vibrams since the general idea seemed to make sense to me and they are designed with barefoot running in mind I have seen the flame war arguments about statistics on this so don't bother sharing any of that What I am really looking for is information from people who have tried both running with traditional running shoes and have also tried running with something like Vibrams I want to get an idea about what the difference has been for real people who have actually tried it and who don't have a vested interest in one side of the other,fitness,2386
2297,Being a student I'm not exactly rich I can't currently afford a gym membership or to buy training equipment Luckily my roommate has been kind enough to let me borrow his equipment So far I've been able to get by with the dumbbells and barbells he lent me Recently I realized I have not trained my grip strength in a long long time Unfortunately the only grippers he owns are far too difficult for me Here's the equipment I have at my disposition One weight training bench Several weight disks (2 5 lb 5 lb and 10 lb) Two barbell bars Two dumbbell bars Two 15 lb dumbbells With that gear is there any exercise that I could do to improve my hands' grip strength,fitness,2306
2300,If my goal is size EDIT Since other people with potentially different goals than mines are likely to see this question it would be good if your answer includes the optimal rest times for different goals (strength endurance etc),fitness,2301
2308,Both Gatorade and Powerade claim to help fill your bodies needs of electrolytes vitamins and other nutrients I'm looking to find out if there's documented proof that these drinks really make a difference in your workout or replenishment of nutrients,fitness,2317
2312,I own a gym quality elliptical at home I'm using mainly to do cardio for weight loss purposes Should I be looking into adding other equipment to my home gym or other exercises to my routine in order to get a more balanced workout or perhaps see better results,fitness,2360
2313,There have been a few times in my life where I believe I have experienced the phenomenon called Runners High or the euphoric state during a run where you feel like you can keep running for forever My question is two fold What exactly is this sensation Are there ways to 'train' your body to get into this state quicker,fitness,2316
2320,Is is possible to take on enough protein to build muscle whilst eating a vegetarian diet Many sources of proteins such as meat poultry and fish are obviously ruled out Do you have experience of building muscle without meat I'd be interested to know which foods you do consume,fitness,2321
2328,I use creatine and L-glutamine for my workouts typically taking the L-glutamine about an hour before my workout and creatine immediately after (I don't take them together because I understand they compete for receptors limiting absorption) I also try to keep the load up by taking creatine first thing in the morning and L-glutamine last thing before bed regardless of whether I worked out that day My question is do I need to take these supplements on rest days in order to maintain my load Should I be taking two servings* of each on rest days instead of just one Are the daily servings unnecessary *A serving for me is typically a heaping spoonful dissolved in water or cold tea (I know that a sugary drink would help absorption but I'm not willing to take the downside of the sugar),fitness,2370
2329,I regularly workout on my own but on the occasions I workout with a training partner I find my motivation increases my output increases and perhaps most importantly my overall enjoyment increases Jason Ferruggia (a world-renowned S&amp;C coach) has always said that having a good training partner is one of the best things you can do to enhance your rate of progress With this in mind how do you go about finding a training partner if indeed you workout with a partner at all Is it possible to walk into a gym and find people there Is it possible to workout with friends (Especially if you're there to exercise seriously rather than catch up and chat) What experience do you have on finding a training partner,fitness,2331
2334,Whenever jogging for long distances after some time I feel my breathing is quite laboured The only solution is to slow down my pace for a while before proceeding I have checked with my GP and I don't have asthma Are there any exercises or techniques I can use to improve my breathing or lung capacity that will be a benefit while I'm jogging,fitness,2338
2335,The number of push-ups I can do is dismal I have tried over the years to increase the number and have received to pieces of advice Start easy and try something like a raised bar or railing and work your way down or start on your knees until you strengthen your arms Keep persisting even you can initially only do a few you will eventually be able to do more I've tried both approaches but never seem to get anywhere more than around 15 and then collapse in a heap What can I do to increase the number and be able to do more without it being a major struggle as neither of the above methods seems to work,fitness,2350
2344,I have just won my school's 200m race which means I qualify for the Athletics in a month's time At the moment my time for 200m is 36 37 secs I am 12 years old and this is my first race over 200 What should I do to practice for it,fitness,2357
2346,Should or shouldn't I run when it is cold Is it easy to pull a muscle,fitness,2355
2352,During my run today I suddenly felt weak with hungry about 15 minutes after I started This only happens some times -- not every run I feel very hungry and weak and I can usually only make it to about the 20 minute mark before I have to stop I assume it must be nutrition related Today I had Breakfast 3 x multigrain weetbix with light milk 1 tub of light yoghurt slice of toast with slice of cheese and vegemite glass of apple and mango juice Midmorning cup of tea with spoon of sugar Lunch chicken breast in roll with some chips 600mL Coke zero I went for the run in late afternoon Any advice appreciated,fitness,2368
2354,What techniques are there for identifying areas you need to work on and that you will be likely to injure so you can work on that areas before they get injured Update Most of the activities I do are high explosive all round work-outs like combat sports,fitness,2385
2365,To what extent can a good exercise programme help to recover lost muscle in people over 70 who while very fit and active have not exercised regularly in earlier years,fitness,2369
2366,I heard to help muscle growth one has to sleep a lot after doing a workout How long is the recommended one Does this mean the best time to workout is at night so you can go to sleep immediately after,fitness,2367
2378,Here is a good definition of mental toughness Mental toughness is having the natural or developed psychological edge that enables you to Generally cope better than your opponents with the many demands (e g competition training lifestyle) that are placed on you as a performer Specifically to be more consistent and better than your opponents in remaining determined focused confident resilient and in control under pressure Where can I learn more about mental toughness and how to develop it,fitness,2382
2379,Are there any substantiated health risks to a high protein low-carb diet,fitness,2408
2395,I usually do a 10-20 mins Cardio (Treadmill/Elliptical/Cycling) before I go for the weights and other exercises Is this a good practice Would there be any advantages if I order my routine differently,fitness,2397
2400,FiveFingers are great shoes for running hiking and general lounging I believe that running barefoot has improved my fitness and also general running ability -- even with conventional shoes But they possess an interesting characteristic that my wife loves to remind me of they stink Not just a little stink These are a put those things out on the patio and go take a shower level of stink Vibram states that you can wash your FiveFingers in the washing machine and then air dry This gets rid of the stench for a short period but it usually comes back after wearing the shoes a few times If I wear Injinji socks with the shoes it keeps the stink away but that's not going to be practical once Minneapolis emerges from it's arctic winter For the sake of my marriage what's the best way to keep my FiveFingers from stinking,fitness,2401
2405,I know my form isn't terrible but it certainly isn't perfect either How do you work on improving it Are there certain exercises that will strengthen the right muscles and force better form Do you concentrate on footfall while running,fitness,2410
2409,What weight training exercises can I do with dumbbells that will benefit me most for running 5-10ks Are stomach crunches/sit ups worth doing too,fitness,2438
2416,I always see BMI charts posted in various health related places and I know life insurance companies use it for assessing risk I've heard the normal range of the index is supposedly based on what normal was in 1800s Poland Is this true In any case should a reasonably bulky person using cardio/strength training ever expect to hit that normal range in the normal course of events or might one expect to stay in the 'overweight' category due to new muscle mass,fitness,2417
2418,Each day I drink lots of coffee and energy drinks (redbull 355ml cans) I go to gym 3 times a week (on evenings) Are there any effects on my workouts I stopped drinking any caffeine (at least from coffee and energy drinks) for 3 weeks and didn't feel any changes Not during daytime nor before during or after my workouts My friends often tell me that my heart will explode from such huge amounts of caffeine (I read about caffeine OD and felt caffeine induced disorders symptoms) My question is what's the effect of caffeine on heart/body when person is working out,fitness,2419
2424,My gym got a new back extension machine recently and it is horrible It's designed for someone much smaller than me the angles are all wrong and I find it very difficult to isolate the right muscles (I end up working my legs instead) Is there a way I can target those muscles and do weight training using other equipment available at the gym Edit I had been lifting > 100 pounds with the old back extension machine,fitness,2426
2425,I'm a long distance runner thats not really a fan of all the goo type products I'm curious if there are any natural sources of concentrated sugars with the right balance of electrolytes for long distance running I know that fruits are the most obvious natural sources for these nutrients but which fruits Is there a specific mix of fruits Dried fruits Should salt be added Is the high fiber a concern (don't want to have to go to the bathroom during a race),fitness,2427
2428,While using the freestyle technique of swimming what is the proper way to breathe Is using the nose to breathe out while under better or is there any difference Is there a specific number of 'strokes' that should be done before taking a breath I've been told to alternate your breathing sides and to always make them opposite of the arm raised out of the water is this correct,fitness,2460
2429,There are multiple technique out there with the two I mainly use being breastroke and freestyle Is there a difference between the two as far as their effectiveness in a cardio workout Is there a technique that stands supreme for cardio or is swimming in general just effective,fitness,2453
2430,Recently I have started Yoga but I find myself unable to hold any position more than ten seconds I was told to exaggerate my posture but I simply could not My flexibility is horrific and feel counter productive even when I follow the Yoga books and routines (books and videos) It has been two weeks and I am having hard time improving it Is there a modified way to help me get into the basic positions of Yoga before I can at least be effective in beginner Yoga workout How can I improve,fitness,2443
2433,Should one continue to exercise even when sick I know it may depend on the sickness but what about minor things like a cold or fever Are there chronic sicknesses where you should still regularly exercise,fitness,2434
2436,I go for a 5km before work 2-3 times a week with a longer run at weekends I was doing crunches and other weight based exercises on the off days but have been advised to do it after my runs My question is why is this a better way to do it,fitness,2437
2450,I do several times a week strength and cardio training (Thai boxing to be specific) but also try to mix in extra weight sessions to build up muscle mass Is it good or bad to mix these two I've heard contradictory opinions none backed by evidence Which of the following is more correct Workout every day alternate the type of training (time sink recovery is tricky injuries heal slower) Do both in the same session (is it too much load for one session which one should go first ) You can't have it all it's a tradeoff stick to either one or the other,fitness,2452
2455,Are there benefits with stretching right after exercising Does stretching afterwards affect the risk of injury,fitness,2470
2456,Why is it common to rest between sets of repetition Could I instead of resting exercise another muscle group,fitness,2480
2462,Many creatine distributors health forums etc recommend avoiding mixing creatine with citrus juices as supposedly the citric acid could combine with the creatine to produce creatinine which isn't a useful substance for strength training and bodybuilding However it occurs to me that stomach acid is stronger and more acidic than any juice that one is likely to drink So is there something specific about citric acid and creatine that would not apply to stomach acid or is the creatine/citrus warning a myth,fitness,2463
2468,I'm spending most of the day in front of the computer (10+ hours) and as expected my wrist tendons experience strain during work Normally this wouldn't be much of an issue but after I have started training more aggressively (especially with free weights) I feel slight pain and weakness in the wrists when they are at unnatural position under load The frequency of training is not the issue -- usually at most 3 times per week and I do torso/arms exercises only twice per week Now the questions Which arm exercises are known to put less strain on the wrists I'm interested in upper-arm/chest exercises mostly but advice for other muscle groups is appreciated as well Is there something else I can do to reduce the problem (training accessories special exercises other) Edit I'm doing exercise on the weight machines and cables mostly some free weights and stretching No push ups whatsoever,fitness,2482
2472,What exercises do you recommend if one's main target is broad shoulders (and chest too but less priority) Does reducing exercises for other muscle group help Any other tips,fitness,3234
2473,There are plenty of selections that athletes have in selecting socks Most of these socks are ear toward moisture whicking material My question is do these type athletic socks make a difference in the overall care of the foot and thus performance of the athelete,fitness,2474
2481,I have seen fitness programs that focus six days of workout per week and following three or four weeks have an entire recovery week The term recovery is misleading because you still workout six days a week but it's just on a lighter weight I am wondering why or if this week is needed,fitness,2562
2483,Are two or three finger push-ups a matter of finger/hand or arm strength What techniques should I use to learn two or three finger push-ups (if it is finger strength how do I build this up etc ),fitness,2486
2484,I can't do a single decent chin-up are there any easy alternatives that I could build up in quantity as a forerunner to being able to do chin-ups Alternatively are there are any weights exercises that could help achieve this Are there any online resources that outline a program for beginners to learn chin-ups and increase the number Maybe something similar to hundredpushups com that I can follow daily (I know they are working on a program called 25 pullups),fitness,2489
2485,I'm looking for some exercises that I can do in a swimming pool that will help my muscles to recover after a workout I've seen footballers on TV walking/jogging in the swimming pool the day after a match If you can provide some specific exercises and also timings for when this should be done (e g immediately after the workout or next day etc ) Could doing exercises in a pool actually provide more strain on the muscles if overdone,fitness,2502
2490,Is there a difference between the protein found in red meat (like beef and ostrich) and white meat (like chicken and pork) and protein from fish and should you aim to get these in in any particular ratio to one another Or could protein intake coming mostly from just one of these types be sufficient,fitness,2498
2492,After a hard work out it's generally a good idea to not stop immediately but rather to cool down What is the specific purpose of cooling down Does not properly cooling down affect the actual efficiency of the work out itself,fitness,2497
2493,Having already asked why a cool-down is so important my next question is how do you properly get into a cool down Please be specific of how to get into this cool-down with metrics that can either be measured for ALL exercises or to a specific type of work-out,fitness,2496
2494,I know that this may sound silly but I was wondering if there is a proper way to pedal the road bike I've noticed that you can be pedaling more with the front or balls of the feet or by staying flat for the most part or even having the heel of your foot slightly angled down Is there a specific way to pedal that will yield the most efficient use of 'foot power' If so what makes that specific technique more efficient,fitness,2505
2504,Recently I've read some articles that suggest that you should go below 90 degrees On the other hand I've talked with a trainer in my gym and he usually places a bench behind him so that he couldn't go below 90 What is your take Below 90 or 90 Note When I'm talking about degrees I mean the angle your shin bone and femur makes,fitness,2558
2509,So I've always wondered what about running makes you have to go to the bathroom Why is it that it seems to accelerate the downward progress of any you know Or maybe I'm the only one this happens to I'm asking seriously I want to know why,fitness,2522
2512,I have been participating in Zumba lately and I feel more stiff after I do something else rather than Zumba Is Zumba a good choice to working out or is it more a fun choice if it was Zumba or nothing What does Zumba do,fitness,2518
2513,What difference if any will it make if my hands are over the bar rather away from me or behind the bar towards me when doing a chin-up Does this work different sets of muscles Is one more difficult than the other Should my workout contain different sets of both ways or is it just a preference thing,fitness,2519
2521,I was just given a set of weights - adjustable weight dumbells - as a present but I have no idea what sort of weights/how many reps I should be doing in order to achieve the best results I'm looking to increase the strength of my arms and wrists (lean strength ) and hope it can increase my strength for playings sports like tennis squash and so on Is there a rule of thumb for weights/reps I should be aiming at,fitness,2523
2534,I spent about 6 to 7 years working out hard both in the gym and running when I was in college When I graduated and got a job I stopped working out cold turkey After about 3 years working I realized I needed to get back into exercising regularly I've since since started working out again and weight more than ever I want to lose weight and gain muscle Should I take supplements that are all protein or should I take supplements that provide more carbohydrates,fitness,2535
2537,Many chemical processes that used to be time-consuming or tiresome can be worked around e g migraine vitamin deficit bad eye-sight Endurance training and muscle anabolism are just chemical processes Is there a theoretical reason for why they are always done through tiresome exercise,fitness,2542
2543,I hear sometimes that after running you should wait with eating for 30 or 40 minutes (may be the metabolism is still in fat burning mode ) What is the reason for this advice How long exactly should I wait And is it valid for any food or is e g okay to eat a banana after the exercise,fitness,2565
2547,A while back I injured my wrist and while I have a clean bill of health now during that time I was not able to work my upper body (delts lats biceps triceps pects) Was there some way I could be been safely working my upper body during those weeks,fitness,2548
2549,My girlfriend has been on Weight Watchers for quite awhile and although she's lost a considerable amount of weight she's still over 60 lbs away from her final goal The problem is that for over the past month she's been stuck at the same weight (give or take a pound) She's pretty strict on tracking her diet intake and works out 4-5 days a week (mainly cardio on her own cardio/strength training with her trainer 2x a week) She's still noticing clothes getting looser so we're pretty sure her fat loss and muscle gain are evening out Of course seeing this big plateau in weight loss is pretty demoralizing and between the two of us we cannot find new things to try outside of exchanging new exercises our trainers throw at us Granted everybody's different but are there some effective tricks for pushing past a weight loss plateau I've read that women can have a harder time dropping weight compared to men but she was making great progress and she's just been stuck at the same point EDIT She's hit a couple plateaus in the process so far but they were short term for 2-3 weeks at most before progress became visible again So she's aware that they are a natural part of the process This current plateau has gone past that point which is a big reason for the demoralizing point of view I've also gone through losing over 50 pounds myself so I'm familiar with what it takes to lose weight So I've picked up a lot of tips myself that I've passed along to her but they haven't helped so far,fitness,2553
2556,Counting calories is one thing but trying to keep track of things like fat protein fiber and carbohydrates are just as important in a good overall exercise plan It's not that hard to find nutrition information on processed foods but when you buy fresh produce and the like it's a lot harder to find the information NOTE This is about everyday food (fruits vegetables meats etc ) not fast food Has anybody found a good resource for (a) finding out nutrition information of food that do not normally come in packaging with that information and possibly (b) being able to track that information for diet purposes (or combining them for recipes to find overall information) I've looked at http //nutritiondata self com/ before but I've found a number of great healthy recipes have ingredients that it doesn't have or are difficult to find Also trying to build out a recipe is quite time consuming if there's more than a few ingredients (especially if you have to go through the process of converting units to fit the site's need),fitness,2563
2573,Are there any documented studies that show how sleep effects your workouts or athletic performance It would seem that more sleep would help and less sleep would hinder performance but that's just an educated guess Is there anything out there that documents this or counters this,fitness,3251
2574,Given the fact that it doesnt distinguish between lean body weight and fat weight why is body mass index so widely used to determine ideal body weight When I started seriously exercising a number of years ago (lifting weights and cardio) I gained 20+ pounds and dropped 2 waist sizes in my pants I'm not muscle bound but do have a lot more muscle now then when I started According the BMI chart for my height and weight I'm borderline obese yet in reality I'm quite fit At an annual physical my doctor pulled out the BMI chart looked at me again and said well that obviously doesn't work for you What's a better way to measure/guage fitness or appropriate weight Is it solely by measuring % of body fat,fitness,2581
