Id,Body,oblast,odgovor
2576,I have strong very short hamstrings and a weak flexible lower back If I try to touch my toes I get about 1/2-way down my shins However most of that mobility is in my lower back If I lie on my back and lift my foot in to the air I can get it about 2' off the ground (as in Suptap?d??gu??h?sana ) Any more than that requires my back to bend So when I try to stretch out my hamstrings I stretch out my lower back instead Meanwhile my hams stay short How can I stretch my hamstrings but not stretch (and strain) my lower back,fitness,2588
2584,I like to keep a latish schedule sleeping often around 2-3 AM I'm often eating odds and ends late at night If someone eats Meals A B &amp; C of certain calorie content and then timeshifts his schedule so that he's eating the same meals later at night and closer to when he's about to sleep will he gain excess weight If so why,fitness,3901
2586,When I do squats I place my feet slightly wider than shoulder width pointed outwards at about 30 degrees I still have trouble keeping my balance going all the way down without bending forward heavily My ankles are not particularly flexible I have tight achilles tendons and hamstrings and I think that I am not able to bend my lower legs far enough to keep my weight centered over my feet I basically fall over backwards and my shin muscle gives out unless I come up on my toes I've tried using small weights under my heels with some success but I wonder if I should focus on increasing my achilles tendon flexibility or is this just an issue of weakness in my lower legs,fitness,2587
2592,I have read about and tried intermittent fasting in the past few months with some great results The only hiccup was getting sick for about 3 weeks and losing that will to continue with it until I restarted it recently I was wondering what others experience were with intermittent fasting and also any recommendation of websites books research etc on the subject My personal experience is that when I am fasting I actually feel better and seem to be a bit more engergized I even feel more energy when I workout in a fasted state -rich,fitness,2599
2595,I go through a bi-weekly exercise program that includes long distance running sprints front crawl upper body compound exercise and stretching I would think my metabolism and protein needs varies with those activities so what strategy for timing and amounts should I adopt to try to optimize my protein consumption in each case The different types of activities I am interested in are running long distance (e g 7 5+ miles) running sprints (e g 12 minute Cooper or 5K) slow front crawl (e g 45 to 60 minutes) compound upper body exercises (e g 45 minutes),fitness,2611
2600,I have a long-standing (no pun intended) injury which gets worse when doing any kind of leg exercise that puts strain on the groin area For example sit-ups press-ups and plank exercises all cause pain in that area I will hopefully be having surgery soon to fix the problem now that it's been diagnosed However I want to exercise without putting strain on this area of the body and would like some opinions on any exercises that will help keep me in shape during this period I'd like to work the ab area and I need to get some cardio exercise (my weight is going up horribly during this fallow period) What experience do people have of keeping things going while recovering from injury,fitness,2629
2601,I'm about to start training for a 15km trail run and am wondering if the crossfit endurance program is effective Is it worth getting a gym membership so I can do the heavy squats and deadlifts involved,fitness,3734
2606,What is normal rate of fat loss Is it changing depending on how much person has left to normal BMI (considering he/she doesn't want any extra muscle weight),fitness,2610
2613,There have been several questions about sleep deprivation asked here The general response seems to be don't do it This seems to be what google says too However I have a baby coming to my house soon This coupled with a full time job and a part time programming addiction is going to restrict the amount of sleep I will be able to get So I need to prepare myself to cope as much as possible My main goals at this time will be mental alertness and vitality I am assuming weight training will be off the cards It also makes sense to me to lay off the heavy carbs and obviously steaks etc Am I right How much cardiovascular training should I be doing What intensity Are there other exercises that may help Are there ideal sleep patterns to try to follow I've heard conflicting reports about the benefits of a 20 minute nap What kind of diet should I try to follow Are there any supplements that may help,fitness,2616
2615,I was cycling with a group it wasn't a particularlly hard ride and it wasn't terribly hot outside During a break one of the riders didn't look good at all and commented that he didn't feel well We offered him some fluids and some food which he declined Now there could have been an infinite number of things wrong with this guy but it raised a question in my head What are the symptoms of dehydration and can you visually tell if someone is dehydrated,fitness,2640
2622,I had been a avid weight lifter and runner for a number of years but I slacked off for a few (4) years and have gotten to be in pretty rough shape I've also noticed that I've developed something of a hunch which I suspect is from always being at the computer (first school then work) Aside from posture and stretches which I've started to do (and have seens some minor results from) are there any exercises that can help straighten out a hunch,fitness,2625
2633,I do a fair amount of weightlifting; in particular heavy compound lifts power-lifting style I also compete on a target pistol team Over the years I've heard a number of coaches and marksmen recommend that serious shooters stay away from heavy lifting because it could affect arm stability/precision when holding the pistol The physical requirement for this sport is to be able to hold a 2 lb pistol (with one hand/arm only) at arm's length with elbow locked as steady as possible for 5-10 secs So my question are these two sports at odds Can someone give an explanation for why heavy lifting might (or might not) compromise my ability to hold the pistol as steady as I could if I didn't lift,fitness,2668
2644,Has anyone read Why We Get Fat And What to Do About It Here is the book on amazon His basic argument is this (my words) The author argues that insulin in large part is responsible for regulating how much fat you have the more the insulin the more fat Insulin tells your fat cell to absorb and maintain their supply of fat and not to release it into the blood stream Insulin is produced in response to the presence and amount of blood sugar in your body when you start to eat your blood sugar increases Fructose and carbohydrates rapidly increase your blood sugar levels resulting in a highly elevated level of insulin Eating a lot of fructose and carbohydrates every day will result in a condition known as insulin resistance This will result in your body having an elevated level of insulin at all times making you virtually incapable of using anything but glucose and carbohydrates as energy Because the cells in the rest of your body quickly run out of energy you get hungry faster because you are just coasting off of the carbs from your last meal My question is is Gary Taubes correct,fitness,2945
2647,For most of my life I stretched out before cycling to avoid cramps or pulling a muscle However I discovered last year that I could skip stretching exercises in favor of a slightly extended warm-up period riding gently for about five minutes and avoiding any strenuous climbing Is stretching before non-weight bearing exercise (like cycling) detrimental to performance Can gently stretching a cold muscle harm it Should the intensity of your workout change when (or whether) you stretch out (My knowledge on this is strictly limited to trial and error with my own body and exercise routine so it'd be helpful if answers were non-anecdotal ) Related Will stretching make me slower on Bicycles SE,fitness,2655
2649,When I was a kid we spent nearly every waking moment playing games and such OUTSIDE We didn't have computers or video games to consume our time Today's kids have a lot of modern devices that keep them inside and static How much time should kids be actively playing (exercising) a day or week The NFL (American National Football League) has an ad campaign (Play-60) that encourages an hour a day of play Does anyone know if there's any data to support this or any other amount per day,fitness,2650
2656,I recently spent some time googling to find treadmill workouts for specifically weight loss but it turned out to get nothing than couple of mediocre essays Can anyone recommend either online resources or provide sample workouts for treadmills,fitness,2666
2657,I've been suffering from Runner's Knee for the last couple of weeks and I've read in some places to put heat on your knee and other places to put cold (like the above referenced webmd article) Which is it Is it one or the other or should I use cold after I walk or run and heat before bed or something else,fitness,2662
2658,I find after strenuous exercise (competitive basketball specifically) that my knee needs a couple days to recover Are there any specific exercises I can do to strengthen the joint and reduce my recovery time I prefer in-home techniques Specifics I jammed my knee into a rock while fielding a ground ball three years ago and have had issues since I wear a brace/sleeve whenever jumping is involved though I usually can run with no pain 95% of the time I'm fine I started to wear the sleeve because I had occasions where I'd come down to the ground and my knee would buckle like it wanted to give out completely When there's pain (minor generally just a hindrance on stairs) I tend to have a hard time with any squat type movements particularly with weight (like a toddler),fitness,2675
2661,I've got the Vibram KSO currently and it works great especially for trail running However running on cement starts to hurt after a while I'm thinking of getting a different kind but there are several types that look like they could be candidates such as the Bikila the KSO Trek Has anyone had any experience with these How do I pick the right model,fitness,2940
2665,I'm looking to keep increasing my endurance when I can't do lower body exercises Are there any interesting high-intensity programs out there that don't rely on your legs For reference Beachbody's Insanity and P90X Plyometrics are what I typically use for a cardio workout Ideally I'd like a similar level of interval/circuit training that I can do at home when my knee is cranky,fitness,2692
2667,I would prefer to measure my body fat rather than weigh myself Is monitor like this worth its money or should I look for something else,fitness,2669
2670,Does smoking effect the muscle building process I understand it can effect your endurance,fitness,2681
2671,I am a distance runner and sometimes go running on trails where there aren't likely to be many people Since I have type-1 diabetes I must carry a blood glucose tester and a source of quick sugar with me particularly since exercise can lower blood sugar While this all amounts to a pretty small amount of equipment it's more than fits comfortably in the pockets of my running shorts What are some ways to carry this gear without it impeding running or causing discomfort We're talking about maybe 200-300g of total mass though space for a little bit more would not be bad,fitness,2679
2673,Let me start by saying that I am a Systems Engineer and have been working professionally for the past 10 years in a very demanding and stress oriented environment This has not allowed me to care for my physical body for that period of time Before that throughout high school and college I was in fair shape I am currently 5'11 weight about 185lbs and would guess to say that I have about 10-15% body fat My skin stretches due to the fact that I have that much body fat and that I've gained and lost weight repeatedly throughout these 10 years Starting from late November 2010 I begun working out mainly concentrated on losing body fat and gaining endurance and strength Currently I have 2 session exercises broken out as follows Session #1 (morning time) - 30 minutes of working out the chest biceps triceps and sit-ups - 40 minutes of elliptical - 15 minutes of treadmill at 3 5 speed Session # 2 (night time) - 30 minutes of working out the chest biceps triceps and sit-ups - 35 minutes of cycling - 15 minutes of treadmill at 3 5 speed I've lost about 10 lbs since I started and gained strength and endurance However I have not gained any muscle mass on my upper body and my lower body (legs thighs buttocks) is full of fat and not proportional to my upper body So my question is why am I not gaining enough muscle on my upper body and why am I not losing the fat on my lower body Any advice on what type of work out to do to lose more fat and strengthen my lower body at the same time gaining muscle mass on my upper body Thanks,fitness,2677
2676,I've been wondering about this for some time now A LOT of diets include sweet potatoes as a source of complex carbs which would be just fine if I lived in US Since I don't there aren't any available to me ( and no it's not the price you just CAN'T buy them) Therefore could the sweet potatoes be substitued with regular potatoes,fitness,2678
2685,How do I know that it's time to buy running shoes before they start looking like this,fitness,2687
2694,I am currently doing 45 minutes of cardio (static bike) keeping my heart rate above 160bpm 3 times a week and working my way up to 60 minutes 3 times a week However it is boring as hell and that current 45 minutes seems to drag on forever I have tried listening to music watching a movie taking the bike out but nothing i have done so far has got me into the mentality can't wait to exercise I am still stuck at man I have to exercise Based on past experience when I don't enjoy something something seems to happen and I stop doing it because I do not enjoy it So my question is how do I enjoy cardio Unfortunately I cannot afford to sign up with a yearly contract with a gym at the moment because of family commitments and financial situations,fitness,2704
2712,Currently I am taking a multivitamin fish oil and I recently added vitamin D supplements (D3 to be specific) My current routine is take each of the three (along with some unrelated medication in pill form) after I eat breakfast each day The addition of the Vitamin D supplement has led me to wonder if taking all of these at the same time of the day is the best idea or if it would be better to take them separately For example my multivitamin already has 400 IU of Vitamin D in it and then I am adding another 1000 IU in the D3 pill Is my body capable of ingesting this much of the vitamin (along with everything else in the multivitamin) at the same time or will some of it be wasted and end up being excreted Would it be better to take one at morning and one at night,fitness,2714
2715,Is it true that i should wear thick clothes such as a hoody while doing cardio to sweat more Or is it just water weight that gets put back on when you drink I have heard both,fitness,2716
2718,Well this one is embarrassing as hell to ask but its a real issue for me I do dips often as people say that's good but different people say different things - that bench press will make them more noticeable or that it will make them better I am also doing 45-60 minutes on the cross ramp exactly the same with inverted bench press I just don't know what makes it better and what makes it worse,fitness,2719
2720,In Tim Ferriss' The Four Hour Body the claim is made that lactose intake seems to inhibit fat loss Note that it is not claimed that it causes fat gain Like many claims in this book it is (and the author is upfront about this) anecdotal and he does not provide an explanation for why it might be so So my question can anyone verify that this is or isn't the case,fitness,2724
2725,I'd like to build a daily or bi-daily strength and flexibility workout around a new exercise ball I have What are some good exercises to start with,fitness,2936
2728,When searching for the internet or even talking to trainers you will get an infinite number of routines How should one choose a routine that is best for him Is there any logic about it at all I'm not addressing the exercises themselves but to the general diversion of muscle groups across days of the week It looks like every mix is possible even when I'm looking for the most recommended routines Of course most of the routines don't include any explanation other than you will see the results in X months The only logical thing about routines that I've heard is that it's better to do the Biceps exercises the same day you do the back and Triceps on the shoulders + chest day because the big muscle exercises also effort the according arm-muscle This way you provide full rest for the Biceps/Triceps when it's not their workout day Is this true can I have more examples for this kind of sense in the vague world of routines I'm working out since August and my results are not satisfying enough I'm not looking for reasons of why I didn't grow up the way I wanted but for a fresh routine to become more motivated and consistent It's just so hard to pick one and it seems so consequences-full I'm having 4 workout days a week,fitness,2732
2735,I'm looking for some practical yet tasty solutions for a high protein diet I like food that has intense flavour In a bid for this question not to be closed can you please post a bit of information on the nutrional value of the food For example Egg whites 11g of protein per 100g,fitness,2739
2736,Let's say I'm a little too fat to be doing a real push up Do you recommend me to push up with my knees supporting my body first and then progress further OR Do you think it's better if I start with the less push ups (say 5 10 15 incremental over days) My goals are to increase endurance strengthen my wrists forearms and chest Disclaimer I'm not really fat No offence to any if they sorta are,fitness,2737
2740,I jammed my shoulder a few years ago while catching myself in a skateboard fall and since then it has had issues off and on where during periods where it bothers me I can't do pushups or dumbbell work The injury has been in the aggravated period for the last several months and is showing no signs of getting better It is affecting my workouts at least those involving chest/back/shoulders (i e any exercises that involve pressure on the shoulder) I've seen chiropractors with little success I haven't tried physical therapy and I haven't gone to a specialist through my Primary Care Phsyician Stretching and yoga also not a big help The injury doesn't get worse and doesn't get better Just is there slightly annoying and especially annoying with certain exercises,fitness,2802
2752,When specifying sets and reps like 5x5 3x5 (in general XxY) which is which It seems like it usually means X sets of Y reps but on some forums I see logs that seem to indicate that either they are (a) doing dozens of 1 rep sets (which might be valid) or (b) they are using the notation in the other order (i e X reps done Y times ) Is there a traditional way of reading/writing these,fitness,2759
2756,I'm attempting to understand if I should be using something other than whey (isolate) protein shake after my gym workouts (weight lifting and core strengthening) There are lots of specific products advertised both on TV at the gym and at the supplement store that have names like Bulk or hydroxycut as well as many many more My question is Is the science in on whether these other products have some advantage over just taking a straight 100% protein powder mixed with pure water I'm not an elite bodybuilder just looking to stay fit an healthy and ensure I don't lose any lean muscle mass,fitness,2757
2760,I know that there is the standard 8x8oz glasses or ~ 3 liters of water per day But today I read that since about 75% of muscle is water people using their muscles intensively need more water about two times as much as standard So my question is at which point does more become too much How much water can I drink before I start hurting my kidneys Background I'm currently drinking about 5 liters of water per day if training about 4 if on rest,fitness,2764
2767,Does it make any sense to use caffeine/menthol slendering gels There are many products for women and also some from (I've seen abdomen gel from shiseido) Do such gels work Do you recommend any EDIT What I mean by those gels working is do they really increase fat loss in the areas where you use them,fitness,2781
2771,I heard on a podcast that pounds of fat burn calories at a different rate than pounds of muscle The thinking is that a pound of fat sitting idly over the course of the day requires X calories whereas a pound of muscle sitting idly over the course of the day (that is to say without being vigorously exercised) requires X+Y calories because muscle is more expensive for your body to maintain nutritionally speaking That would seem to imply that if one were to undertake a workout regimen designed to build muscles (lots of strength training minimal focus on cardiovascular activities) that the additional muscle mass would result in the body burning more calories per day while it was in its at rest state That would seem to imply that one would then be able to lose some of their fat weight as they would now have a more favorable ratio of caloric intake to caloric expenditure Is this a healthful approach to weight loss If someone were in a situation where they were overweight (but not yet obese) is strength-training a logical approach to achieving a higher fitness level,fitness,2776
2774,In the link below Mark Rippetoe of Starting Strength says that when positioning oneself for a bench press http //startingstrength wikia com/wiki/FAQ The_Lifts#The_Bench_Press Your eyes should not be gazing directly beneath the bar but rather looking just past the foot side of the bar Any idea what the foot side of the bar is When lying on my back should the bar be right above my eyes,fitness,2943
2784,As the title says I would like to know what is the best time to drink water is it before during or after having a meal Also suppose the answer was during what quantity is recommended,fitness,2790
2792,I'm currently taking in 100 grams a day of protien via whey powder I used to take 250 grams when I was training I've read that you should intake 1 gram per pound of body weight you have when training I've also seen numbers such as between 0 8 and 1 gram of protein per kilogram of weight a day (about 7 grams per 20 pounds So a person who weighs 150 pounds would need around 52 grams a day ) I'm ~250lbs right now I was 260 but I'm cutting wieght to 240 I'm not doing any serious training right now Edit To be clear my question is about how much is too much for the body before seeing side effects such as kidney problems digestion problems etc Not necessarily about wieght loss At my body weight how much is too much,fitness,2907
2796,If you look at charts they will all say that I'm obese or worse I'm 6'1 ~250 (dropping to 240) but I'm not fat These charts seem to base it on the fact that my weight vs my height is not in proportion According to those charts I should be 150-170 (which IMO is far too small Not to offend anyone ) Shouldn't this be based on body fat % instead of weight vs height What body fat % should be considered obese Or is the term obese not meaning fat but weight overall relative to what your heart can handle which would have those charts making more sense,fitness,2797
2799,Since being told that biceps are bad for punching speed I've toned down the amount of pull-ups I do and switched to a wide grip with palms facing away to emphasize the lats more than the biceps Now I'm worried whether lats are also bad for punching speed I've also heard that triceps-training exercises like push-ups are good particularly if you can do them plyometrically (i e with a hop at the top) What other exercises are good or bad for punching and kicking speed Any suggestions would be appreciated though I would prefer exercises that can be done at home (e g calisthenics) I would also accept answers to the slightly different question what muscles are good/bad to train without recommending particular exercises EDIT Thanks for the many responses One thing that would be greatly appreciated are some suggestions of exercises for training kick speed since nobody has commented on that yet EDIT #2 As has been commented below speed and accuracy are more a matter of muscle coordination than muscle strength However I was thinking of starting martial arts classes in the summer so I'm hoping to get exercise tips to better direct my workouts until then,fitness,2942
2805,I am a sprinter around the grand old age of 21 At our track there is a lot of debate of whether cold bath (or ice bath if you're brave enough) aids recovery of the muscle What are your opinions Are there any other post-training techniques that you would recommend Dont think this has to be sport-specific as it will easily go across the board for most sports Stu,fitness,2806
2811,If your goal is increasing strength must you always train to the point where you feel the burn later,fitness,2815
2812,How should I choose a multi-vitamin as a man Should I just try and get the most potency/per dollar product Are there any well known generally accepted superior brands,fitness,2826
